id,title,year,journal,doi,paper_type,unit_of_analysis,level_of_theory,dependent_variable_family,methods,industry,country,time_period,units,n_sample,authors,theories,topics,keywords,research_question,mechanism_summary,theoretical_contribution,practical_implication,limitations,future_research,abstract,apa_citation,source,pdf_path,text_path,note_path,extraction_model,extraction_version,ingested_at
amj-vol-69-no-1-roberson-2026,Stewardship at Scale: A New Editorial Term at AMJ,2026,Academy of Management Journal,https://doi.org/10.5465/amj.2026.4001,editorial,organization,meso,na,Editorial (From the Editor); reflective and programmatic argument that synthesizes prior AMJ editorials and articulates an agenda for the 24th editorial term,Not reported in paper,Not reported in paper,Not reported in paper,Not reported in paper,Not reported in paper,"Roberson, Q.",contributive justice; organizational justice; stewardship theory,dei-initiatives; management-education; methods-theory; philosophy-of-science,contributive justice; developmental reviewing; editorial infrastructure; editorial stewardship; generative AI in scholarly publishing; inclusion; knowledge translation; peer review; reviewer development; scale and complexity,Not reported in paper,"Roberson advances a normative, programmatic argument rather than a causal model. She contends that AMJ's very success — roughly 2,000 annual submissions, a 13.8 five-year impact factor, and a global author base — has intensified demands on editorial, reviewing, and developmental systems in ways that threaten the journal's core commitments to intellectual pluralism and developmental reviewing. Building on the ""stewardship"" orientations of prior editors Beyer, Tsui, and Rynes, she argues that sustaining excellence at scale requires editorial infrastructures intentionally oriented toward contributive justice and inclusion: systems that broaden meaningful participation in authorship, reviewing, and editorial roles while preserving the standards that define the journal. The mechanism is institutional rather than individual — values endure only to the extent that the systems enacting them can adapt.","The editorial frames editorial leadership as ""inclusive stewardship"" and advances contributive justice and inclusion as central editorial principles for the 24th term, extending prior editors' stewardship orientation by explicitly foregrounding individuals' belonging within an institutional context and their access to meaningful opportunities to participate in and be recognized for core scholarly activities. It reframes AMJ not simply as a publication outlet but as a field-shaping developmental institution whose continued excellence depends on the intentional evolution of editorial systems — aligning developmental effort with scholarly value creation, investing in reviewer development as field-building work, and cultivating a more inclusive, globally connected pipeline of contributors.","Authors, reviewers, and editors are called to approach submission, review, and editorial service as a collective enterprise. The 24th editorial team will streamline workflows, publish synthesized guidance from prior ""From the Editors"" essays to support manuscript readiness, run review development workshops and Community Accelerator outreach, expand knowledge-translation efforts (e.g., The Lit Review podcast; an ""AMJ Behind the Scenes"" feature), and ensure transparent, ethical use of generative AI consistent with AOM's AI policy. Success will be monitored through mixed-methods indicators — including topical and methodological diversity, review timeliness, and qualitative feedback on clarity, developmental value, and perceived fairness — treated as tools for responsible oversight rather than targets.",Not reported in paper,"Roberson sets a forward agenda for the 24th editorial term: developing pre-submission guidance that synthesizes accumulated wisdom from prior ""From the Editors"" essays; aligning developmental initiatives with AOM Divisions, Interest Groups, and PDWs; investing in reviewer development workshops and Community Accelerator outreach to broaden access to AMJ's editorial processes; and expanding knowledge-translation efforts such as The Lit Review podcast and an ""AMJ Behind the Scenes"" feature. She also calls for continued, transparent engagement with generative AI in authoring and reviewing, and for mixed-methods monitoring of whether editorial systems enact the journal's pluralistic and developmental commitments at scale.",FROM THE EDITOR STEWARDSHIP AT SCALE: A NEW EDITORIAL TERM AT AMJ,"Roberson, Q. (2026). Stewardship at scale: A new editorial term at AMJ. *Academy of Management Journal*, 69(1), 1-5. https://doi.org/10.5465/amj.2026.4001",AMJ/vol-69-no-1,library/AMJ/vol-69-no-1/pdfs/Roberson 2026 Stewardship at Scale A New Editorial Term at AMJ.pdf,library/AMJ/vol-69-no-1/text/Roberson 2026 Stewardship at Scale A New Editorial Term at AMJ.txt,notes/amj-vol-69-no-1-roberson-2026.md,claude-opus-4-6,v1,2026-04-14
nbs-2026-02-acosta-navas-2026,"The Ethics of Artificial Intelligence: Principles, Challenges, and Opportunities, by Luciano Floridi. Oxford University Press, 2023. 272 pp.",2026,Business Ethics Quarterly,https://doi.org/10.1017/beq.2026.10108,book-review,na,na,na,Book review; critical essay engaging Floridi's normative framework for AI ethics,Not reported in paper,Not reported in paper,Not reported in paper,Not reported in paper,Not reported in paper,"Acosta-Navas, D.",informational ethics; principlism (bioethics),ai-automation; ai-ethics; business-ethics,AI ethics; AI governance; engineering approach; ethics of artificial intelligence; good AI society; productive AI; sociotechnical systems; value tradeoffs,Not reported in paper,Not reported in paper,Not reported in paper,"The reviewer argues that Floridi's normative frameworks and taxonomies offer compelling resources to motivate deeper philosophical engagement and to guide ethically informed practical discussions in AI ethics. The book is positioned as rich input for business ethics researchers interested in the responsibilities of organizations that develop, adopt, deploy, or regulate AI, and for understanding the role of frontier technologies in channeling large-scale societal transformation. Business ethicists are uniquely situated to contribute frameworks for the responsibilities of private actors in the AI ecosystem.","The reviewer identifies three limitations of Floridi's framework. First, despite its global aspirations, the book tends toward Eurocentrism in policy recommendations, emphasizing bureaucratic regulatory bodies that may be difficult to realize in countries with fewer technical and financial resources. Second, the book overlooks the problem of tradeoffs, assuming that optimal balances can be attained between conflicting societal values (e.g., open source vs. safety, privacy vs. fairness in facial recognition) rather than acknowledging that tragic choices may be unavoidable. Third, Floridi's ""engineering approach"" refuses to define AI and dismisses productive AI's capabilities based on a decade-old example (Watson), leaving conceptual ambiguities that powerful actors could exploit and failing to account for recent advances in agentic and reasoning systems.","The reviewer identifies three ripe areas for future research. First, developing policy recommendations beyond Eurocentric bureaucratic models, expanding on international cooperation, industry-wide standards, accountability, and scalable education for the public, government workers, and technologists. Second, investigating how to address value tradeoffs responsibly, including identifying procedural constraints such as participatory frameworks for reaching acceptable compromises. Third, examining the sociotechnical systems and meso-level institutions (research labs, corporations, professional associations) in which AI is developed and deployed, including the conditions for legitimate decision making, operational constraints, and relationships with governments. The reviewer also calls for a fully-fledged theory of agency and intelligence to ground AI regulation.","fter the public launch of ChatGPT, the Future of Life Institute published an open letter calling for a moratorium on the development of frontier artificial intelligence (AI) systems. It was signed by over thirty thousand scholars, industry leaders, and public intellectuals. Judging by media headlines at the time, the signatories were not alone. Open AI’s launch created widespread concern regarding the rapid pace of AI’s development, and the risks it posed for humanity. Luciano Floridi seems to disagree with the reasoning behind this initiative. In his book The Ethics of Artificial Intelligence, he states: “It is because we lack a clear sense of socio-political direction that we are worried by the speed of our technological travel. We should be. Yet the solution is not to slow down, but to decide together where we want to go” (79). With adequate normative frameworks for AI, he says, we can simultaneously mitigate its worst risks and reap its greatest benefits. The book sets out to provide systematic and comprehensive guidelines for what he calls a “good AI society.”","Acosta-Navas, D. (2026). The ethics of artificial intelligence: Principles, challenges, and opportunities, by Luciano Floridi. Oxford University Press, 2023. 272 pp. *Business Ethics Quarterly*, 36(1), 179-183. https://doi.org/10.1017/beq.2026.10108",NBS/2026-02,"library/NBS/2026-02/pdfs/Acosta-Navas 2026 The Ethics of Artificial Intelligence Principles, Challenges, and Opportunities, by Luciano Floridi. Oxford University Press, 2023. 272 pp..pdf","library/NBS/2026-02/text/Acosta-Navas 2026 The Ethics of Artificial Intelligence Principles, Challenges, and Opportunities, by Luciano Floridi. Oxford University Press, 2023. 272 pp..txt",notes/nbs-2026-02-acosta-navas-2026.md,claude-opus-4-6,v1,2026-04-14
nbs-2026-02-aguilar-hernandez-2026,Is academia addressing relevant questions to support a circularity transition in Latin America and the Caribbean?,2026,Journal of Industrial Ecology,https://doi.org/10.1007/s44498-026-00038-8,empirical-mixed,industry,macro,environmental,"Convergent mixed-methods design combining 19 semi-structured expert interviews (generating 51 priority stakeholder questions), an updated PRISMA systematic literature review (335 peer-reviewed records, 405 research objectives), and thematic analysis following Braun and Clarke (2006); alignment between interview and literature datasets assessed with a Research Alignment Ratio (RAR) computed over 27 sub-themes within four overarching categories","Cross-sectoral (waste management, manufacturing, agriculture/forestry/livestock, energy, construction)","Latin America and the Caribbean (11 countries plus 3 regional experts; literature dominated by Brazil 49%, Mexico 12%, Chile 8%, Colombia 6%)","Interviews March-November 2024; literature review 1997-April 2025 (updating Gallego-Schmid et al., 2024)",CE expert interviews and peer-reviewed scientific publications on CE in LAC,19 interviews (51 stakeholder questions); 335 publications (405 research objectives),"Aguilar-Hernandez, G. A.; Guerrero, A. B.; Vásquez-Ibarra, L.; Rebolledo-Leiva, R.; Gallego-Schmid, A.",stakeholder engagement; transdisciplinary research,circular-economy; global-south; latin-america; stakeholder-engagement,Circular economy; Global South; Latin America and the Caribbean; Research gaps; Stakeholder engagement; Thematic analysis,"Is academia addressing relevant questions to support the Circular Economy transition in Latin America and the Caribbean? Specifically, the paper determines (1) which stakeholder questions are being directly or indirectly addressed in current literature, (2) which areas remain underexplored or overlooked, and (3) how research agendas can be better aligned to support CE implementation.","- Two datasets compared: 51 priority questions from 19 CE expert interviews and 405 research objectives from 335 peer-reviewed publications on CE in LAC
- Four overarching thematic categories (with 27 sub-themes): (1) technology and data, (2) culture, education and society, (3) economy and market, (4) policy
- Research Alignment Ratio (RAR): per-sub-theme ratio of interview frequency to literature frequency (centered on 1), classified as High, Medium, or Low alignment
- Three key factors driving misalignment between academic research and stakeholder needs: (1) science communication, (2) the process of setting research priorities and defining expected roles, and (3) the level of transdisciplinarity within CE research in LAC

The paper characterizes alignment as a descriptive, thematic comparison rather than a causal test: thematic overlaps at the category level coexist with considerable sub-theme misalignments, particularly in socio-cultural, economic, and policy dimensions. Drawing on the discussion, the authors argue that misalignment is sustained where science communication is fragmented and one-way rather than dialogue-based, where research priorities are set without participatory engagement with non-academic actors (leaving sub-themes such as citizen engagement, SME economic impacts, or monitoring of public policy underexplored), and where CE research remains disciplinarily siloed rather than transdisciplinary. Pragmatic stakeholder engagement, boundary organizations, stronger national-level financial instruments, and transdisciplinary research processes that bridge academic fields while actively involving practitioners and policymakers are offered as enabling conditions for closer alignment.","The paper advances the debate on the societal role of academic research in sustainability transitions by providing an empirically grounded, LAC-specific assessment of alignment between stakeholder priorities and academic CE research. It contributes a Research Alignment Ratio methodology for systematically comparing thematic frequencies across stakeholder and literature datasets, and identifies three key drivers of misalignment (science communication, priority setting, and transdisciplinarity). It positions LAC as a Global South case study that invites the global CE research community to reflect on whether current research agendas adequately address pressing stakeholder needs while preserving academia's critical independence.","Policymakers, businesses, and practitioners gain a clearer view of where existing CE research provides an actionable knowledge base and where gaps remain—especially in culture/education/society, economy/market, and policy sub-themes such as cross-sectoral interaction, citizen engagement, SME economic impacts, policy instruments, and monitoring of public policy. For academic researchers and funders, the study calls for strengthening participatory research designs, dialogue-based science communication, national-level financial instruments for CE research, and transdisciplinary collaborations that actively involve practitioners and policymakers to translate scientific insights into CE implementation in LAC.","The interview sample size (19 experts, 35% response rate) may limit full thematic saturation, reflecting the comparatively small pool of CE experts in LAC versus regions such as Europe. There is a mismatch between interviewees' country expertise and the literature's concentration on Brazil (only 21% of interviewees specialized in Brazil while ~49% of reviewed studies focus on it), which may introduce bias. The degree of coordination and collaboration among CE researchers themselves across LAC was not directly measured.","Further country-level research—particularly in Brazil, Mexico, Chile, and Colombia—should refine understanding of research alignment in specific national contexts. Future work should investigate the degree of connection and collaboration among CE researchers across LAC, the role of gender dynamics given that ~70% of interviewees were women and CE initiatives in the region appear often driven by women, and how participatory and pragmatic stakeholder engagement approaches can be applied to LAC's cultural and institutional context to co-develop research agendas. Additional empirical work is needed on the informal sector's CE practices beyond waste management.","Latin America and the Caribbean (LAC) is advancing toward a Circular Economy (CE), supported by expanding policy initiatives and a growing body of academic research. Over the past decade, CE academic studies in the region have examined developments at multiple sectors, scales and circular strategies, thus, contributing to CE research in the region. Yet, it remains uncertain whether academic research addresses the critical questions most relevant for non-academic stakeholders—including policymakers, practitioners, and businesses—to support the CE transition in LAC. To assess this alignment, we compared 51 priority questions identified by 19 CE experts in LAC countries with the research objectives of 335 scientific publications on CE in the region. The analysis reveals the extent to which stakeholder priorities are reflected in academic literature and highlights persistent gaps where further research is needed. Our findings stress the importance of fostering more collaborative, transdisciplinary, and stakeholder-oriented research to accelerate a just and effective CE transition in LAC.","Aguilar-Hernandez, G. A., Guerrero, A. B., Vásquez-Ibarra, L., Rebolledo-Leiva, R., & Gallego-Schmid, A. (2026). Is academia addressing relevant questions to support a circularity transition in Latin America and the Caribbean? *Journal of Industrial Ecology*. https://doi.org/10.1007/s44498-026-00038-8",NBS/2026-02,library/NBS/2026-02/pdfs/Aguilar-Hernandez 2026 Is academia addressing relevant questions to support a circularity transition in Latin America and the Caribbean.pdf,library/NBS/2026-02/text/Aguilar-Hernandez 2026 Is academia addressing relevant questions to support a circularity transition in Latin America and the Caribbean.txt,notes/nbs-2026-02-aguilar-hernandez-2026.md,claude-opus-4-6,v1,2026-04-14
nbs-2026-02-ahmed-sewaid-2026,Rewards-based crowdfunding as an institutional carrier: The cross-border backing of environmental projects,2026,Journal of Business Venturing,https://doi.org/10.1016/j.jbusvent.2026.106586,empirical-quantitative,firm,cross-level,environmental,"Quantitative observational study using two-stage Heckman selection models (with robustness checks using OLS, linear probability, and coarsened exact matching) on Kickstarter campaign data merged with the country-level Environment Performance Index (EPI)",Rewards-based crowdfunding (Kickstarter projects across all platform categories),Campaigns from 153 countries/territories; backers from 226 countries/territories,April 2009 - November 2016,Crowdfunding campaigns,"290,126 campaigns with 29.87 million individual pledges","Sewaid, A.; Vanacker, T.; Zahra, S. A.",community logic; institutional carriers; institutional logics; institutional theory,cross-national-comparative; entrepreneurship; sustainable-finance,Country institutions; Cross-border flows; Entrepreneurial finance; Environmental projects; Institutional carrier; Rewards-based crowdfunding,"Do environmental projects have an advantage in attracting cross-border funds on rewards-based crowdfunding platforms, and in which direction do funds flow across borders — specifically, do pro-environmental community logics channel cross-border backing from countries with stronger environmental institutions toward environmental projects located in countries with weaker environmental support systems?","Drawing on institutional theory, the authors theorize that global rewards-based crowdfunding platforms act as cross-border institutional carriers infused with a pro-environmental community logic. Because backers on such platforms are motivated by non-pecuniary, prosocial and environmental values rather than market-based financial returns, projects with stronger environmental orientations become salient to backers in countries with stronger environmental protection institutions, who then transmit resources and pro-environmental values across borders. This mechanism is amplified when recipient projects sit in weak-institution contexts, because backers in strong-institution countries recognize the acute resource constraints and global interconnectedness of environmental problems and direct support accordingly. The result is a bottom-up diffusion of pro-environmental logics and resources that overturns the cross-border disadvantages predicted by market-logic-based international entrepreneurial finance research.","The study contributes to institutional theory by conceptualizing global crowdfunding platforms as cross-border institutional carriers that, unlike prior top-down accounts centered on multinationals, returnee elites, or state-linked intermediaries, enable dispersed crowds to diffuse pro-environmental values and resources bottom-up across national borders. It contributes to international entrepreneurship and entrepreneurial finance by showing that pro-environmental community logics in rewards-based crowdfunding reverse the cross-border disadvantages documented for venture capital and angel investing, producing fundraising advantages for risky environmental ventures in weak-institutional contexts. It further extends crowdfunding research by highlighting how community logics — distinct from the market logics dominating traditional finance — reshape global resource flows toward entrepreneurs addressing sustainability challenges.","Rewards-based crowdfunding is a meaningful channel for raising cross-border funding for environmental sustainability projects, with environmentally oriented campaigns attracting a larger share of non-local backers (25.13% vs. 21.45%) than less environmental ones. Environmental entrepreneurs operating in countries with weak environmental support systems should strategically target and cultivate backers in countries with stronger environmental institutions, foregrounding the environmental impact and resource constraints of their ventures to activate prosocial motivations. Entrepreneurs should also invest in well-designed campaign content (video pitches, images, narratives, reward structures) because campaign quality strongly shapes cross-border fundraising success.","The authors do not directly observe individual-level motivations of backers, so results document cross-border funding patterns consistent with pro-environmental community logics rather than directly testing the mechanism. The study uses a single platform (Kickstarter) and a composite country-level Environment Performance Index, leaving open whether findings generalize to other crowdfunding types/platforms and to specific components of environmental institutions (e.g., regulations, subsidies, enforcement). The sample is restricted to 2009-2016 (pre-Paris Agreement), so post-2016 institutional shifts lie outside the analysis.","Future research should directly test the underlying community-logic mechanism using surveys, experiments, or qualitative analyses of backer motivations and project communications, and should examine backer heterogeneity and specific environmental policy dimensions rather than composite indices. Longitudinal studies are needed to document how crowdfunding platforms' role as cross-border institutional carriers evolves with technological, political, and social change, and to identify project- and country-level factors (including culture and language) that amplify or dampen this carrier role. Researchers should also investigate reverse flows — how innovations from weak-institution contexts diffuse to developed settings — and test whether the institutional-logic framework extends to funding of other social grand challenges beyond environmental issues.","institutional carriers that transmit backer support across borders guided by pro-environmental community logics. Using Kickstarter data spanning campaigns in 153 countries and backers from 226 countries and territories, we find a positive relationship between projects' environ­ mental orientation and their likelihood of attracting cross-border funding. Moreover, this crossborder support originates from countries with stronger environmental institutions and is espe­ cially directed toward projects in weaker institutional contexts. Our findings differ from pre­ vailing expectations from international entrepreneurial finance research focused on venture capitalists and angels, which emphasize cross-border disadvantages for risky, environmental projects in weak-institutional contexts, while we report cross-border fundraising advantages for these projects. Our study contributes to research on the nexus of institutional theory, interna­ tional entrepreneurship, and crowdfunding research by showing how international crowdfunding platforms can enable the bottom-up diffusion of pro-environmental values and resources across country borders.","Sewaid, A., Vanacker, T., & Zahra, S. A. (2026). Rewards-based crowdfunding as an institutional carrier: The cross-border backing of environmental projects. *Journal of Business Venturing*, 41, 106586. https://doi.org/10.1016/j.jbusvent.2026.106586",NBS/2026-02,library/NBS/2026-02/pdfs/Ahmed Sewaid 2026 Rewards-based crowdfunding as an institutional carrier The cross-border backing of environmental projects.pdf,library/NBS/2026-02/text/Ahmed Sewaid 2026 Rewards-based crowdfunding as an institutional carrier The cross-border backing of environmental projects.txt,notes/nbs-2026-02-ahmed-sewaid-2026.md,claude-opus-4-6,v1,2026-04-14
