id,title,year,journal,doi,paper_type,unit_of_analysis,level_of_theory,dependent_variable_family,methods,industry,country,time_period,units,n_sample,authors,theories,topics,keywords,research_question,mechanism_summary,theoretical_contribution,practical_implication,limitations,future_research,abstract,apa_citation,source,pdf_path,text_path,note_path,extraction_model,extraction_version,ingested_at
amj-vol-68-no-3-bermiss-2025,Reengaging with the Classics,2025,Academy of Management Journal,https://doi.org/10.5465/amj.2025.4003,editorial,na,na,na,"Editorial essay; the authors surveyed AMJ editors and editorial board members to construct a working definition of a 'management classic,' then illustrate three approaches (revise, repurpose, rediscover) with exemplar AMJ papers and apply them to contemporary domains (AI, large digital tech, geopolitical leadership).",na,na,na,na,na,"Bermiss, Y. S.; Farh, C. I. C.; Simons, T.; ter Wal, A. L. J.; von Krogh, G.; Gruber, M.",March and Simon turnover framework; job design theory; social exchange theory; structural contingency theory; transformational leadership theory,literature-review; responsible-management-education; theory-development,doctoral education; management classics; rediscover; repurpose; revise; theory development; transformational times,"How can scholars effectively draw on management classics to inform developments in the world of today, particularly amid transformational phenomena such as AI, digital platform consolidation, and geopolitical polarization?","- Core argument: Management classics — widely influential works that have shaped theory and practice — remain valuable but are often subject to ""institutional forgetting,"" typified citation, and selective attention; substantive reengagement (rather than ceremonial citation) generates new theoretical and practical insights for transformational times.
- Three pathways for reengagement:
  - Revise: challenge taken-for-granted assumptions and propose substantive changes (e.g., Sine, Mitsuhashi & Kirsch 2006 revising Burns & Stalker 1961 by showing new ventures benefit from mechanistic, not organic, structures).
  - Repurpose: leverage insights from a classic to resolve a problem in an adjacent theory (e.g., Colquitt & Rodell 2011 repurposing Blau's 1964 social exchange theory to reconceive justice-trust relations).
  - Rediscover: identify previously overlooked theoretical claims in a classic and bring them back into focus (e.g., Trevor 2001 rediscovering untested ideas in March & Simon 1958 about individual-level determinants of voluntary turnover).
- Application domains: AI era (job design theory, bounded rationality), large digital tech (Chandler's Strategy and Structure), and political polarization (Burns's transformational leadership).
- Boundary condition / caution: reengagement requires ""vigilant reading"" that situates classic theory in its political, social, and economic context rather than blindly idealizing or transposing it.

The editorial argues that scholarly progress is cumulative and path-dependent, which causes classic works to be selectively read and ""typified"" in citation practices; deliberate revising, repurposing, and rediscovering counteract this drift and let foundational theories address new phenomena while clarifying scope conditions.","The editorial offers a typology — revise, repurpose, rediscover — for substantive engagement with management classics, distinguishing it from normative or ceremonial citation. It clarifies how each pathway produces a distinct kind of theoretical contribution (new boundary conditions, novel cross-domain application, recovery of latent claims) and links these pathways to contemporary phenomena (AI, large tech firms, geopolitical leadership) where classics regain explanatory power.","The editors call on scholars, doctoral advisors, and journal reviewers to move beyond ceremonial citation of classics — introducing PhD students to foundational texts, encouraging deep engagement, and proactively suggesting opportunities to reengage with classics in reviews — so that contemporary research on AI, digital platforms, and geopolitical disruption can build on, rather than reinvent, prior insights.","The authors note that the three approaches they identify are ""merely indicative, and not exhaustive""; surely additional ways to reengage with the classics exist beyond the typology offered.","The editorial invites scholars to reengage with classics across three illustrative domains: (a) the AI era, by extending bounded rationality, job design, and team-effectiveness classics to AI-augmented work; (b) large digital technology firms, by revisiting Chandler's strategy-structure thesis; and (c) leadership amid political polarization and geopolitical tension, by reexamining Burns's transformational leadership in light of values conflict and instability.","Classics in management offer a wealth of ideas and knowledge—arguably, wealth that is underutilized.","Bermiss, Y. S., Farh, C. I. C., Simons, T., ter Wal, A. L. J., von Krogh, G., & Gruber, M. (2025). Reengaging with the classics. *Academy of Management Journal*, 68(3), 465-474. https://doi.org/10.5465/amj.2025.4003",AMJ/vol-68-no-3,library/AMJ/vol-68-no-3/pdfs/Bermiss 2025 Reengaging with the Classics.pdf,library/AMJ/vol-68-no-3/text/Bermiss 2025 Reengaging with the Classics.txt,notes/amj-vol-68-no-3-bermiss-2025.md,claude-opus-4-7,v2,2026-04-30
amj-vol-68-no-3-caruana-2025,The Boundaries of Modern Slavery: The Role of Exemplars in New Category Formation,2025,Academy of Management Journal,https://doi.org/10.5465/amj.2022.0210,empirical-qualitative,industry,macro,social,"Qualitative case study with discourse analysis (Fairclough's three-dimensional approach) of consultation submissions, 1,240 UK media articles (2010-2016), 13 expert key informant interviews, parliamentary debates, and bill drafts surrounding the UK Modern Slavery Act 2015.","Multi-sector legal/policy formation around modern slavery (encompassing organized crime, sex work, agriculture, construction, domestic work, fishing, factory labor)",United Kingdom,2010-2016,"Linguistic exemplars in textual data (consultation submissions, media articles, parliamentary debates, bill iterations, key informant interviews)","1,240 UK media articles, 21 oral and 102 written consultation submissions, 40 Public Bill Committee submissions, 19 parliamentary debate transcripts, 13 expert interviews","Caruana, R.; Crane, A.; Ingram, C.",boundary work; category formation theory; exemplar model of categorization,corporate-social-responsibility; grand-challenges; modern-slavery; supply-chain-transparency,boundary work; category formation; discourse analysis; exemplars; grand challenges; modern slavery,"How and why do organizational actors deploy category exemplars in discourse surrounding new categories to establish the social and symbolic boundaries of an incipient category, in the absence of an established prototype, as illustrated by the formation of the legal category of modern slavery?","- Key constructs: typifying, familiarizing, and scoping exemplars; symbolic vs. social boundaries of categories
- Triggering conditions: introduction of a new legal category lacking a prototype; competing actor goals (government, NGOs, business, media)
- Process / phases: pre-initiation (2010-2012), initiation (2013), contestation (2014), formalization (2015 onward)
- Practices: typifying exemplars list common attributes to clarify symbolic boundaries and pull in social boundaries; familiarizing exemplars use metaphor/simile/analogy to import meaning from adjacent categories (e.g., organized crime, prostitution) and provisionally establish symbolic boundaries while creating social-boundary ambiguity; scoping exemplars use diagnosis-prognosis-bridging to expand social boundaries by including outlier members (e.g., children, overseas domestic workers)
- Boundary conditions: exemplar success depends on (1) goal alignment with category promoters and (2) stakeholder consensus on the appropriateness of including suggested actors/practices
- Emergent outcomes: deliberate inclusion of children and overseas domestic workers; exclusion of refugees and regular employers (as perpetrators); restriction of prostitution scope to forced prostitution

The process traces how, absent a prototype, different actors discursively construct provisional category boundaries through three distinct linguistic forms of exemplar that operate dynamically across four phases. Familiarizing exemplars (e.g., organized crime, sex work analogies) initially attract attention but risk overinflating social boundaries; typifying exemplars consolidate central category meaning by listing common attributes; scoping exemplars (used mostly by NGOs) deliberately push the social boundary outward to include otherwise excluded members. The success or failure of any exemplar depends on whether it aligns with the goals of category promoters (the UK Government) and whether stakeholders converge on its appropriateness — a dynamic that explains why children and migrant domestic workers were ultimately incorporated as victims, but refugees were not.","The paper extends the exemplar model of categorization beyond concrete category members by theorizing exemplars as discursively constituted linguistic representations that actively shape new category boundaries. It contributes (1) a typology of three linguistic forms of exemplar (typifying, familiarizing, scoping); (2) a reconceptualization of exemplar salience as contextually determined by goal alignment and stakeholder consensus rather than being a stable attribute; (3) a dynamic four-phase model linking exemplar deployment to specific social and symbolic boundary effects across category formation.","The findings have policy implications because the success or failure of different actors in deploying persuasive exemplars during category formation can determine which subjects (e.g., children, refugees, migrant workers) are included in or omitted from legal protections — the difference, in the case of modern slavery, between incarceration as a criminal and liberation as a victim. Organizations engaging in new policy or category-formation processes (e.g., on climate change, supply chain modern slavery) should be mindful of the role of exemplars and the windows of opportunity they create.","The case is distinctive because it concerns a legal category that is hierarchically defined by legislators with a fixed end point (the passage of the Act), rather than a market or organizational category that emerges more organically. Findings are most generalizable to contexts of deliberate category creation involving official category definers (governments, professional associations) and to categories with strong policing of boundaries. The single-case design limits cross-context comparison.","Future studies could conduct comparative case studies across multiple legal categories, examine how legal categories interact with related market categories (e.g., slave-free products), and extend exemplar-based analysis to other grand challenges such as climate change, biodiversity, migration, and inequality. Research could also explore the temporal redefinition of categories and how exemplars contribute to their endurance over time.","Modern slavery is one of the most prominent grand challenges facing organizations today. Yet, its precise meaning, and the scope of people and practices it subsumes, remain hotly contested. The recent formation of a legal category of ""modern slavery"" represents a critical point in establishing clear meanings and boundaries. While existing research on categories has shed light on how such new category meanings and boundaries may be shaped, we lack insight on how this happens in the absence of category prototypes that demarcate the meaning and membership of categories. We turn to category exemplars as an important but, as yet, poorly understood tool influencing category formation and subsequent membership. We conduct a systematic analysis of discourse surrounding the formation of the new category of modern slavery to identify three distinct forms of exemplars (typifying, familiarizing, and scoping), and develop a model that links actors' use of these exemplars to specific boundary effects across four phases of category formation. We also reveal the conditions under which different exemplars were successful in influencing the final category. We thereby contribute to the literature an exemplar-based theorization of new category formation that explains how categories associated with grand challenges like modern slavery are formed.","Caruana, R., Crane, A., & Ingram, C. (2025). The boundaries of modern slavery: The role of exemplars in new category formation. *Academy of Management Journal*, 68(3), 507-539. https://doi.org/10.5465/amj.2022.0210",AMJ/vol-68-no-3,library/AMJ/vol-68-no-3/pdfs/Caruana 2025 The Boundaries of Modern Slavery The Role of Exemplars in New Category Formation.pdf,library/AMJ/vol-68-no-3/text/Caruana 2025 The Boundaries of Modern Slavery The Role of Exemplars in New Category Formation.txt,notes/amj-vol-68-no-3-caruana-2025.md,claude-opus-4-7,v2,2026-04-30
amj-vol-68-no-3-fenters-2025,How Identity Structure Influences Identity Adoption: The Case of Hybrid Entrepreneurs,2025,Academy of Management Journal,https://doi.org/10.5465/amj.2023.0520,empirical-qualitative,individual,micro,social,"Inductive, qualitative grounded-theory study based on 82 semi-structured interviews with academic entrepreneurs at eight U.S. universities; analysis combined informant drawings of identity networks, the Twenty Statements Test, and three phases of open/axial/selective coding.",Higher education / academic entrepreneurship (faculty engaged in startups or licensing),United States,Not reported in paper,Faculty members who had engaged in commercializing their research (started companies and/or licensed inventions),82 informants,"Fenters, V. W.; Balven, R. M.; Ashforth, B. E.; Waldman, D. A.; Siegel, D. S.",identity construction / identity work; intrapersonal identity network theory; multiple identities theory; schema theory,entrepreneurship; new-venture-creation; organizational-identity,academic entrepreneurs; entrepreneurial identity; hybrid entrepreneurs; identity adoption; identity structure; intrapersonal identity network,"How does the cognitive structure of individuals' intrapersonal identity network influence the process of adopting a new identity? To answer this, the authors first ask: How do individuals cognitively structure their intrapersonal identity network in the first place?","- Key constructs: intrapersonal identity network; four dimensions (depth, overlap, density, range); three structure types (hierarchical, integrative, web); experienced needs; identity functions; evaluative logics
- Identity structures: hierarchical (high depth), integrative (high overlap), web (high density), with horizontal range informing each
- Adoption paths and needs: proving path (need for upward affirmation; new identity acts as conduit); holism path (need for coherence in a purpose; new identity acts as partner); distributive path (need for action-based resources; new identity serves utilitarian function)
- Evaluative logics for stabilizing/revising adoption: competing logic (proving), converging logic (holism), additive logic (distributive)
- Outcome: reinforcement or revision of the new identity's position in the network

The process model holds that an individual's cognitive structure focuses attention on some dimensions while limiting others, which makes a particular identity-based need salient. Individuals adopt a new identity to serve a function corresponding to that need (conduit, partner, or utilitarian resource provider) and then evaluate the adoption with a logic that matches the function. Whether the new identity is reinforced or revised in the network depends on whether it satisfies the underlying need without unduly threatening other identities, producing a recursive structuring process.","The study identifies three distinct cognitive structures (hierarchical, integrative, web) built from a common set of four dimensions, challenging the long-held assumption that hierarchies of importance are pervasive and showing that high levels of certain dimensions tend to preclude others. It develops a process model linking each structure to a unique adoption path, experienced need, identity function, and evaluative logic, thereby explaining why provisional identities are reinforced or revised. It also reframes hybrid and entrepreneurial identity research by showing that the broader network of identities, not just the academic-entrepreneur dyad, shapes how an entrepreneurial identity emerges and stabilizes.","Assessing a person's identity structure reveals what they treat as opportunities versus threats and which incentives or framings will resonate. Entrepreneurial training programs (for example, NSF I-Corps) are likely to be more effective when tailored to the trainee's structure: emphasizing market validation for hierarchical structures, alignment with a higher purpose for integrative structures, and resource flows for web structures. Managers can use the same insight to design role assignments and rewards that fit employees' structures.","The sample is restricted to U.S. academic entrepreneurs who voluntarily entered entrepreneurship and were therefore likely to have well-articulated identity sets, which may limit transferability to less voluntary or non-academic contexts. Although the authors believe their tripartite typology and adoption model travel broadly, this generalizability has not been empirically tested beyond the present setting. The study also does not speak to antecedents of structures or to outcomes beyond identity adoption.","Future work should examine how each identity structure influences thinking, feeling, and acting beyond identity adoption, including links to performance, growth, and well-being; assess transferability of the tripartite typology to other work settings; explore conscious versus unconscious identity adoption; investigate what it means for an identity to ""fit"" a structure and how individuals tolerate misfit; and identify antecedents (developmental, individual differences, identity motives) that shape which structure emerges.","Scholars have theorized that individuals have an intrapersonal identity network comprised of multiple identities and the relationships between them. However, it remains unclear how individuals cognitively structure these networks and how such structures influence the adoption of a new identity. This matters because such adoptions facilitate growth and adaptation, and the literature hints that the structure will affect the adoption process. To explore these issues, we conducted an inductive, qualitative study of hybrid entrepreneurs (specifically, academic entrepreneurs). Our findings reveal that individuals combine four dimensions (depth, overlap, density, and range) to create one of three cognitive structures (hierarchical, integrative, or web), and that high levels of one dimension may preclude high levels of certain others. Further, we develop a model of how these structures impact the adoption of a new identity by focusing attention on some dimensions while limiting attention to others. In doing so, they guide individuals into a unique adoption path involving a certain need that identity adoption satisfies by serving a particular function in the network. This function influences the logic used in determining whether the new identity becomes stabilized in the network. Thus, our theory contributes to the literatures on multiple identities and hybrid entrepreneurs.","Fenters, V. W., Balven, R. M., Ashforth, B. E., Waldman, D. A., & Siegel, D. S. (2025). How identity structure influences identity adoption: The case of hybrid entrepreneurs. *Academy of Management Journal*, 68(3), 567-597. https://doi.org/10.5465/amj.2023.0520",AMJ/vol-68-no-3,library/AMJ/vol-68-no-3/pdfs/Fenters 2025 How Identity Structure Influences Identity Adoption The Case of Hybrid Entrepreneurs.pdf,library/AMJ/vol-68-no-3/text/Fenters 2025 How Identity Structure Influences Identity Adoption The Case of Hybrid Entrepreneurs.txt,notes/amj-vol-68-no-3-fenters-2025.md,claude-opus-4-6,v2,2026-04-30
