id,title,year,journal,doi,paper_type,unit_of_analysis,level_of_theory,dependent_variable_family,methods,industry,country,time_period,units,n_sample,authors,theories,topics,keywords,research_question,mechanism_summary,theoretical_contribution,practical_implication,limitations,future_research,abstract,apa_citation,source,pdf_path,text_path,note_path,extraction_model,extraction_version,ingested_at
amj-vol-69-no-1-bouchard-2025,Vulnerability Practices among Professionals in Multidisciplinary Settings,2025,Academy of Management Journal,https://doi.org/10.5465/amj.2023.0645,empirical-qualitative,team,meso,social,"Inductive qualitative case study of a weekly multidisciplinary meeting in an academic primary-care clinic. Insider–outsider team combined 20 recorded weekly meetings (~93 hours of audio-video), 19 semi-structured interviews, and 7 participatory group discussions; 27 episodes of vulnerability practices were isolated and coded across six analytic phases using grounded-theory-style open coding, role analysis, chronological sequencing, and theoretical model building.",Primary health care (academic family medicine clinic),Canada (Quebec),10 months of observation (conducted online during COVID-19 lockdown),"A weekly multidisciplinary team meeting assembling a senior psychologist, senior physicians, medical residents, psychology interns, social workers, a nurse, and patient partners; 27 episodes of vulnerability practices",20 meetings observed; 27 episodes analyzed; 19 interviews; 7 group discussions; typically 8–10 participants per meeting,"Bouchard, M.; Chreim, S.; Langley, A.; Boivin, A.","holding environments (Kahn, 2001; Winnicott, 1965); practice theory; professional work and jurisdictional authority (Abbott, 1988); theory of ritual (Bell, 1992)",emotions-at-work; meaningful-work; organizational-behavior-hrm; qualitative-methods,holding environment; multidisciplinary settings; power dynamics; professional work; ritual; social support; theorizing; vulnerability practices,How and with what perceived effects do professionals in multidisciplinary settings engage in practices that enable the sharing of doubts and insecurities experienced in the performance of their work roles?,"Professionals operate under institutional norms that equate competence with invulnerability, leaving role-based doubts and insecurities unvoiced. In a dedicated, bounded setting, a ritualized sequence of moves — an invitation to ""take the mic,"" incremental questioning that moves the storyteller from facts to emotions, and multifaceted theorizing that abstracts from the case — legitimates disclosure and activates validation, empathy, and advice from colleagues. Theorizing is pivotal: it enacts the interpretive function of a holding environment, contains difficult emotions, and turns a single disclosure into collective learning. Positive appraisals of past episodes feed back into willingness to disclose in future episodes, while under-validation or power imbalances can derail the ritual and undermine the holding environment.","The paper introduces ""vulnerability practices"" as a novel concept naming the ritualized sequence of moves through which group members display, lead others to display, and address work-role doubts and insecurities, and derives an inductive process model linking individual disclosure to communal reflection via theorizing. It reconceptualizes holding environments not as fixed social containers but as precarious, processual accomplishments sustained (or not) episode-by-episode through a tension between social pressure and social support. It also theorizes how power and authority dynamics — especially those tied to multidisciplinarity — seep into vulnerability practices and shape who can be ""held"" and how.","The authors argue that recognizing sustained engagement in vulnerability practices as ""real work"" can help practitioners (including academics) legitimize dedicated settings that function as holding environments (or ""lifeboats"") for coping with pervasive doubts and insecurities at work. For organizations designing such settings in multidisciplinary contexts, attention to ritual predictability, incremental facilitation from facts to emotions, multifaceted theorizing resources, and the mitigation of power asymmetries is essential to avoid under-validation and unintended harm.","The study relies on a single case — a weekly multidisciplinary meeting in one Quebec primary-care clinic — explicitly designed around vulnerability sharing, and was conducted entirely online during the COVID-19 lockdown, which limits the generalizability of the process model to other settings, formats, and professional configurations.","Future work could adopt multi-case designs to compare vulnerability practices across contexts and processes, examine online versus in-person dynamics, and explore other groups mixing disciplinary and seniority statuses to understand how to ""level the playing field."" The authors also suggest investigating how rotating the facilitator role across disciplinary statuses, or convening groups whose members do not otherwise work together, might reshape power dynamics and participants' appraisals of the benefits and risks of vulnerability practices.","Professional workers are expected to display confidence and mastery in their work roles, and may be hesitant to reveal their doubts and insecurities, especially in multidisciplinary settings characterized by status differences. However, scholars have recognized the benefits of sharing vulnerabilities to create opportunities for social support. We contribute to the literature by revealing how this might be achieved through a ritualized sequence of “vulnerability practices” in a dedicated setting. Based on a qualitative study of a weekly meeting where a multidisciplinary group of professionals shares experiences, we develop a process model that explains how vulnerability practices evolve through phases of individual disclosure and communal reflection bridged by theorizing from experiences. We reveal how a delicate tension between social pressure (to display vulnerabilities) and social support (to contain them) underpins these practices, and how this tension is influenced by power relations associated with multidisciplinarity. We show how participants’ appraisals of past episodes shape their willingness to engage in subsequent episodes, reinforcing or undermining the capacity of the setting to serve as a “holding environment” offering interpretation and containment. We thus reveal holding environments at work to be precarious accomplishments, created and maintained through ritualized vulnerability practices, and imbued by power relations.","Bouchard, M., Chreim, S., Langley, A., & Boivin, A. (2025). Vulnerability practices among professionals in multidisciplinary settings. *Academy of Management Journal*. https://doi.org/10.5465/amj.2023.0645",AMJ/vol-69-no-1,library/AMJ/vol-69-no-1/pdfs/Bouchard 2025 Vulnerability Practices among Professionals in Multidisciplinary Settings.pdf,library/AMJ/vol-69-no-1/text/Bouchard 2025 Vulnerability Practices among Professionals in Multidisciplinary Settings.txt,notes/amj-vol-69-no-1-bouchard-2025.md,claude-opus-4-6,v1,2026-04-14
amj-vol-69-no-1-chon-2025,Not So Fast? Rapid Response to Voice Leads to Perceived Inauthenticity,2025,Academy of Management Journal,https://doi.org/10.5465/amj.2023.1044,empirical-mixed,individual,micro,social,"Mixed-method, preregistered multi-study design combining qualitative content analysis and between-subjects experiments. Study 1 uses a qualitative-plus-experimental design with doctoral students recalling their advisors; Studies 2 and 3 use online vignette experiments with working adults. Analyses include ANOVA, regression, and moderated mediation (indirect effects via authenticity and responsiveness, with change difficulty as a moderator).",Multiple (academia in Study 1; general part-time/full-time workforce via Prolific Academic in Studies 2 and 3),United States (primarily; Western samples),Not reported in paper,Individual followers (doctoral students in Study 1; employees in Studies 2 and 3) evaluating leaders,"Total n = 3,056 across three studies (Study 1: 190 doctoral students from R1 U.S. universities; Study 2: 1,676 employees; Study 3: 710 employees, final sample)","Chon, D.; Sezer, O.; Flynn, F. J.",attribution theory; authenticity in leadership; lay theories of behavior change; person perception,ceo-leadership; governance-leadership; leadership-behavior; organizational-behavior-hrm,behavior change; lay beliefs; leader-centric voice; perceived authenticity; rate of change; responsiveness; subsequent voice,"How does the rate at which a leader changes their behavior in response to leader-centric voice shape followers' evaluations of the leader's authenticity, and how do those evaluations in turn affect followers' willingness to voice concerns in the future?","Drawing on theories of person perception and attribution in leader-follower relationships, the authors argue that followers hold lay beliefs that true, authentic behavior change takes time and effort because it requires a corresponding shift in the actor's core sense of self. When leaders improve rapidly in response to voice, this violates those lay expectations and triggers an attributional search that leads followers to see the change as spurious rather than reflecting an underlying transformation. The resulting authenticity penalty is amplified when the requested change is difficult (because rapid difficult change contradicts lay beliefs most sharply) and attenuated when the change is easy. Because followers evaluate leaders on authenticity as well as responsiveness, rapid change produces offsetting effects that, on net, reduce followers' willingness to voice future concerns—generating a recursive dynamic in voice processes.","The paper contributes to voice research by identifying the rate of leader response as a previously overlooked factor shaping leader evaluations, challenging the prevailing assumption that faster change is unambiguously better. It introduces perceived authenticity as a second, overlooked basis on which followers judge leader responses to voice (alongside utility and responsiveness) and shows how the interplay between authenticity and responsiveness, moderated by change difficulty, shapes cyclical voice dynamics. It also answers Cha and colleagues' (2019) call to address the temporal dimensions of perceived authenticity by theorizing that authenticity judgments depend on followers' comparison of leaders' past and present selves.","Leaders who aim to demonstrate responsiveness by changing rapidly in response to employee voice should be aware that swift transformations can backfire by eliciting perceptions of inauthenticity, especially when the requested change is difficult, which can in turn discourage subsequent voice. The authors do not simply recommend slowing down, because rapid change also signals responsiveness; instead they suggest leaders weigh these trade-offs and can mitigate the authenticity penalty by proactively communicating about why a change is more or less challenging than followers assume.","The studies are largely hypothetical vignette-based designs and focus narrowly on leader-centric voice (discretionary feedback about the leader's own behavior) rather than other forms of voice such as concerns about routine business operations. The research does not capture how followers perceive leader changes at the precise moment they occur in ongoing relationships, and it relies primarily on Western-oriented theory and samples, leaving cultural variation in conceptions of the ""true self"" and authenticity unaddressed.","Future work could conduct longitudinal or experience-sampling investigations of ongoing leader-follower relationships to examine how change-rate evaluations evolve over multiple timepoints and whether sub-variants of change rates (e.g., constant vs. slow-start-then-flurry) moderate the effect. Researchers could also explore possible asymmetries between judgments of authenticity and inauthenticity, test whether different types of leader behaviors (e.g., interpersonal vs. task-oriented) strengthen or attenuate the authenticity penalty, and replicate the findings using non-Western theoretical perspectives and populations with different conceptions of self.","Employees voice their concerns in the hope that leaders will change their behavior. But how do employees evaluate these changes? In the present research, we highlight the rate of behavior change as a key factor in determining leader evaluations: Leaders are seen as less authentic when they change rapidly in response to employee voice because people believe that true change takes time. We investigate this claim with three studies that adopt a mixed-method approach (n 5 3,056). In Study 1, PhD students describe rapid improvement in their advisor’s behavior as less authentic than gradual improvement— even when these changes are desired. In Study 2, we employ a stimulus sampling design to test the robustness of this effect. Followers see rapid improvement as less authentic than gradual improvement across a wide array of leader behaviors. In Study 3, we highlight change difficulty as a moderator and subsequent voice as a downstream consequence: When change is hard, rapid improvement elicits a greater authenticity penalty, which undermines followers’ willingness to voice their concerns in the future.","Chon, D., Sezer, O., & Flynn, F. J. (2025). Not so fast? Rapid response to voice leads to perceived inauthenticity. *Academy of Management Journal*, 69(1), 123–148. https://doi.org/10.5465/amj.2023.1044",AMJ/vol-69-no-1,library/AMJ/vol-69-no-1/pdfs/Chon 2025 Not So Fast Rapid Response to Voice Leads to Perceived Inauthenticity.pdf,library/AMJ/vol-69-no-1/text/Chon 2025 Not So Fast Rapid Response to Voice Leads to Perceived Inauthenticity.txt,notes/amj-vol-69-no-1-chon-2025.md,claude-opus-4-6,v1,2026-04-14
amj-vol-69-no-1-goodwin-2025,Under Pressure to Be Perfect: How Dehumanizing and Rehumanizing Social Cues Lead to Maladaptive and Adaptive Perfectionism in Professional Ballet,2025,Academy of Management Journal,https://doi.org/10.5465/amj.2023.0187,empirical-qualitative,individual,cross-level,social,"Inductive, qualitative grounded-theory study. Data from 19 hours of participant observation at a large U.S. professional ballet company plus 88 semi-structured interviews with 61 professional and semi-professional ballet dancers from 24 companies (in-person and Zoom). Iterative coding moved from open coding to theoretical dimensions and a process model integrating dehumanization and perfectionism.",Professional ballet (performing arts),"Primarily United States, with some international dancers",Late 2019 through the COVID-19 period,Professional and semi-professional ballet dancers across 24 companies of varying size,"61 dancers (76% female; ages 17-40; across corps, soloist, and principal ranks)","Goodwin, R. D.; Garrett, L. E.; Block, A. P.",organizational dehumanization; perfectionism theory; social information processing theory,emotions-at-work; employee-wellbeing; meaningful-work; organizational-behavior-hrm,adaptive perfectionism; maladaptive perfectionism; organizational dehumanization; performance pressure; professional ballet; rehumanization; self-compassion; social information processing; workplace perfectionism,How do social cues within high-pressure work environments influence the experience of different forms of perfectionism?,"Drawing on social information processing theory (Salancik & Pfeffer, 1978), the authors theorize that, under high performance pressure, organizational cues that deny workers' fallibility, agency, subjectivity, and individuality are internalized as organizational dehumanization, activating perfectionistic concerns and self-destructive behaviors in a self-reinforcing maladaptive cycle that culminates in breakdowns. Breakdowns open workers to rehumanizing cues from peers and supportive others, which reaffirm their humanity and facilitate internal shifts toward perfectionistic strivings paired with self-compassionate behaviors, constituting an adaptive perfectionism cycle. Because dehumanizing cues persist in the environment, dancers can relapse, but accumulated experience helps them stay adaptive more of the time. Dehumanization and rehumanization thus function as contextual mechanisms that translate the same performance pressure into qualitatively different perfectionism experiences.","The study identifies organizational dehumanization and rehumanization as underlying contextual mechanisms that separate maladaptive from adaptive perfectionism, shifting the perfectionism literature from a predominantly trait-based view toward a situated, social-information-processing account of how workplace cues activate different forms of perfectionism. It contributes to the dehumanization literature by proposing denial of fallibility as a novel form of dehumanization alongside denial of agency, subjectivity, and individuality, and by showing how workers can internalize dehumanizing cues into self-destructive behavior rather than only rejecting them. It also advances theory on performance pressure by positioning dehumanization (vs. rehumanization) as a key moderator that channels pressure into maladaptive versus adaptive responses and by articulating perfectionism as a dynamic, cyclical process fueled by everyday social cues.","Leaders and practitioners in high-pressure workplaces should recognize that perfectionism is shaped by environmental cues, not merely individual disposition, and take responsibility for affirming workers' fallibility, agency, voice, and individuality. Training managers and peers to detect signs of maladaptive perfectionism (e.g., harsh self-criticism, self-harming behaviors) and to deliver rehumanizing cues such as supportive remarks, constructive feedback, and validation of emotional and physical limits can help workers shift toward adaptive perfectionism. The findings are especially relevant for entry-level professionals in competitive industries such as the arts, academia, healthcare, law, elite sport, and tech, where ""produce or be replaced"" norms cue maladaptive patterns.","The study may not be readily transferable to all competitive organizational settings: the sample is 76-78% female, which may inflate the salience of dehumanization given gendered dynamics of replaceability and objectification, and professional ballet uniquely emphasizes the physical body, so perfectionism is more embodied than in most workplaces. The inductive qualitative design is not intended to isolate causal effects of dehumanization or rehumanization on perfectionism, and qualitative interviews are subject to biased recall and self-protective framing, making it hard to know whether dancers truly shifted to adaptive perfectionism or reframed experiences more positively.","Future deductive and experimental studies should test the moderating effects of dehumanization and rehumanization on perfectionism while controlling for trait perfectionism, conscientiousness, and gender, and should explore gendered dynamics in how dehumanization and perfectionism co-develop. Scholars should extend the model to less physically demanding work, investigate other maladaptive responses (e.g., unethical behavior) triggered by internalized dehumanization, and examine self-compassion as an environmentally induced response rather than a purely individual trait. Additional work is encouraged on organizational-level outcomes such as retention and performance tied to adaptive vs. maladaptive perfectionism, and on the nature of performance pressure (including time-vs-precision tensions) across competitive industries.","Research on workplace perfectionism has focused on harmful consequences of workers’ perfectionism. However, perfectionism is not a uniform experience. Maladaptive and adaptive perfectionism have different outcomes for worker performance and well-being. While perfectionism appears especially prevalent in high performance pressure environments, minimal research has examined how social cues shape workers’ experience of perfectionism. Through an inductive study of professional ballet dancers facing extreme performance pressure, we discovered that social cues influence whether people experience maladaptive or adaptive perfectionism. We found that organizational dehumanizing cues elicited perfectionistic concerns and increased self-destructive behaviors, leading to a vicious cycle of maladaptive perfectionism and an increased likelihood of breakdowns at work. However, rehumanizing cues precipitated a shift toward adaptive perfectionism characterized by perfectionistic strivings and self-compassionate behaviors. We also show how workers can shift back and forth between maladaptive and adaptive perfectionism cycles throughout their careers. We reveal new insights at the intersection of high performance pressure, dehumanization, and perfectionism, offering dehumanization and rehumanization as key mechanisms linking the environment and perfectionism. We also discuss how our findings, though in an extreme context, apply to other high-pressure workplace environments, and open new opportunities to explore the processes of maladaptive and adaptive perfectionism in other domains.","Goodwin, R. D., Garrett, L. E., & Block, A. P. (2025). Under pressure to be perfect: How dehumanizing and rehumanizing social cues lead to maladaptive and adaptive perfectionism in professional ballet. *Academy of Management Journal*, 69(1), 6-45. https://doi.org/10.5465/amj.2023.0187",AMJ/vol-69-no-1,library/AMJ/vol-69-no-1/pdfs/Goodwin 2025 Under Pressure to Be Perfect How Dehumanizing and Rehumanizing Social Cues Lead to Maladaptive and Adaptive Perfectionism in Professional Ballet.pdf,library/AMJ/vol-69-no-1/text/Goodwin 2025 Under Pressure to Be Perfect How Dehumanizing and Rehumanizing Social Cues Lead to Maladaptive and Adaptive Perfectionism in Professional Ballet.txt,notes/amj-vol-69-no-1-goodwin-2025.md,claude-opus-4-6,v1,2026-04-14
