id,title,year,journal,doi,paper_type,unit_of_analysis,level_of_theory,dependent_variable_family,methods,industry,country,time_period,units,n_sample,authors,theories,topics,keywords,research_question,mechanism_summary,theoretical_contribution,practical_implication,limitations,future_research,abstract,apa_citation,source,pdf_path,text_path,note_path,extraction_model,extraction_version,ingested_at
nbs-2026-02-lee-2026-physical-disability-workplace,Physical Disability in the Workplace: A Comprehensive Review and Unifying Framework,2026,Journal of Management,https://doi.org/10.1177/01492063251406535,review,individual,micro,social,"Systematic literature review of 168 articles on physical disability in the workplace, drawn from FT50 and ABDC (FT50 publisher) journals using 11 disability-related keywords in Business Source Premier and PsycInfo, plus ancestry and citation searches of seven seminal disability reviews. Two authors independently coded each article across six dimensions (focus, mechanism/outcome, moderators, disability type, methodology, theoretical basis), reconciled disagreements, then synthesized conceptual patterns into a unifying framework building on Stone and Colella (1996).",Cross-industry (management literature),Primarily Europe and United States (>70% of empirical samples),1976 through end of 2024,Peer-reviewed management articles on physical disability in the workplace,168 articles,"Lee, W. E.; Roccapriore, A. Y.; Lohrke, F. T.; Reutzel, C. R.",Stone and Colella (1996) framework; identity theory; social exchange theory; theory of planned behavior,dei-initiatives; disability-inclusion; literature-review; workplace-discrimination,disability; diversity; diversity climate; equity; health and well-being; identity; inclusion; intra-organizational processes and dynamics; physical health,"How can the fragmented management literature on physical disability in the workplace be synthesized into a unifying framework, and what constitutes a precise, shared definition of physical disability that addresses the lack of consensus and absence of an integrative framework across prior reviews?","Building on Stone and Colella's (1996) seminal framework, the authors integrate focal mechanisms with three categories of workplace outcomes linked to PWPDs, others in the organization, and the organization at large. The framework argues that how PWPDs are treated and how they navigate disclosure and accommodation is shaped by disability attributes and organizational/institutional boundary conditions, which in turn drive heterogeneous individual, interpersonal, and organizational outcomes. The review highlights that aggregation of disability types masks these mechanisms and calls for disaggregated theorization.","The review offers a synthesized and precise definition of physical disability drawing on management, medical, legal, and sociological sources, anchored in the amended ADA (2008), and refines the conceptualization inherited from Stone and Colella (1996). It develops a unifying framework encompassing focal mechanisms, workplace outcomes, and boundary conditions that clarifies the theoretical and methodological fragmentation of PWPD research and identifies underused theoretical lenses (e.g., expectancy violation theory, agency theory) that could advance the field.","Organizations should adopt inclusive hiring practices (bias training, transparent disclosure processes), remove structural and procedural barriers (universally designed workspaces, accessible recruitment tools, streamlined accommodation procedures), and visibly include PWPDs across roles to normalize disability and enhance organizational image. Policymakers should expand support for disability entrepreneurship, incentivize private-sector inclusion, strengthen and extend accommodation mandates to non-standard workers, and subsidize assistive technologies to make accommodation feasible for organizations of all sizes.",Not reported in paper,"Future research should examine interpersonal outcomes (e.g., well-being, organizational commitment of coworkers without disabilities interacting with PWPDs), disaggregate disability types rather than aggregating them, and assess how specific disability attributes (severity, visibility, unpredictability, progression) shape outcomes. Scholars should also explore cross-national and cross-organizational differences — particularly outside Europe and the United States — and apply underused theoretical lenses such as expectancy violation theory and agency theory to questions of perception formation, accommodation monitoring, and performance evaluation for PWPDs.","In the United States, more than a quarter of the working-age population experiences physical disabilities that shape workplace participation and career outcomes. Drawing on 168 articles, we synthesize the management literature to develop a unifying framework of focal mechanisms, workplace outcomes, and boundary conditions. In doing so, we offer a clear definition of physical disability, long absent from management research. We also highlight the fragmented theoretical and methodological landscape, in which most studies aggregate disability types, overlooking critical heterogeneity. Our review charts a path forward by identifying key gaps, outlining directions for future scholarship, and emphasizing the need for stronger theoretical grounding and methodological rigor. Finally, we discuss implications for policy and practice, underscoring how greater inclusion of persons with physical disabilities can advance various workplace outcomes.","Lee, W. E., Roccapriore, A. Y., Lohrke, F. T., & Reutzel, C. R. (2026). Physical disability in the workplace: A comprehensive review and unifying framework. *Journal of Management*. https://doi.org/10.1177/01492063251406535",NBS/2026-02,library/NBS/2026-02/pdfs/Lee 2026 Physical Disability in the Workplace A Comprehensive Review and Unifying Framework.pdf,library/NBS/2026-02/text/Lee 2026 Physical Disability in the Workplace A Comprehensive Review and Unifying Framework.txt,notes/nbs-2026-02-lee-2026-physical-disability-workplace.md,claude-opus-4-6,v1,2026-04-14
nbs-2026-02-li-2026-activism-corporate-reputation,CEO Activism and Corporate Reputation: How Authenticity and CSR Mitigate Stakeholder Misalignment,2026,Journal of Management Studies,https://doi.org/10.1111/joms.70060,empirical-mixed,firm,cross-level,social,"Two-study mixed design: Study 1 is a nationally representative survey (n=1050) rating 525 real BLM statements from Fortune 500 companies and Certified B Corps, analysed via OLS regression and structural equation modelling with Sobel tests; Study 2 is a preregistered 2x2 between-subject randomized experiment (n=600) manipulating CEO activism and CSR initiative, analysed via OLS contrasts and mediation analysis.",Fortune 500 companies and Certified B Corps (Study 1); fictitious retail chain 'Supermarket' stimulus (Study 2),United States,BLM statements issued largely in late May or June 2020,Participants (individual US adults) rating corporate statements,Study 1: 1050 participants rating 525 BLM statements; Study 2: 600 participants (150 per experimental group),"Li, L. Z.; Soule, S. A.",cognitive perspective on reputation formation; signalling theory,ceo-leadership; corporate-purpose; csr-strategy; stakeholder-engagement,CEO sociopolitical activism; corporate social responsibility; moral authenticity; organizational reputation; political ideology; signalling theory,"Under what conditions and through what perceptual mechanisms does CEO activism improve corporate reputation across stakeholders with heterogeneous political ideologies, and how does CSR engagement shape these reputational effects?","CEO activism operates as a visible and politically costly signal that deviates from pure shareholder-value focus and risks alienating ideologically opposed stakeholders; this costliness makes the stance credible evidence of the organization's underlying values, which stakeholders interpret as moral authenticity — consistency between espoused values and actions. CSR engagement functions as a congruent, longer-horizon signal of organizational values that reinforces authenticity perceptions when combined with activism, amplifying reputational gains. Because moral authenticity is valued across the ideological spectrum, congruent activism-plus-CSR signals attenuate the reputational penalty that ideologically misaligned stakeholders would otherwise impose, producing a cognitive-interpretive buffer against partisan discounting.","The paper extends signalling theory by showing that multiple non-market signals (CEO activism and CSR) interact synergistically when congruent, and integrates the signalling perspective with a cognitive view of reputation formation by introducing stakeholders' political ideology as a previously underexplored interpretive dimension. It reframes CSR not only as a reputation premium but as a reputation buffer that overrides ideological disagreement through perceived moral authenticity, distinguishing this mechanism from Godfrey's moral-capital insurance view by locating the buffering effect in audience heterogeneity and cross-strategy spillovers rather than within-domain wrongdoing.","Leaders considering sociopolitical advocacy can mitigate the risk of alienating ideologically opposed stakeholders by pairing CEO activism with substantive, sustained CSR engagement (e.g., B Corp certification, philanthropic donations), because such congruent signals broaden reputational gains across the ideological spectrum. CSR therefore acts as a reputation buffer that makes activism more viable in ideologically diverse environments.","Study 1 is correlational and its mediation analysis does not establish causality or rule out alternative mechanisms; the authors did not control for perceptions of inauthenticity or hypocrisy potentially elicited by the Study 2 control; and the CSR initiative was operationalized in a politically neutral domain distinct from the activism stance, which may explain its null direct effect on authenticity. The authenticity mechanism may not generalize to product markets, and experimental vignettes capture only immediate responses from general-public samples rather than diverse organizational stakeholders.","Examine more contentious and politically costly forms of CSR (e.g., BLM-aligned CSR) to test whether CSR alone can trigger authenticity perceptions in charged domains. Employ non-intrusive methods such as sentiment analysis to trace longitudinal reputational effects in real-world settings, and investigate the antecedents of CEO activism — in particular, why B Corps were less likely than Fortune 500 firms to issue activist statements despite benefiting more from doing so.","Previous research suggests that the effect of CEO activism depends on its alignment with stakeholders' political ideology. We examine when and why CEO activism can enhance corporate reputation across the ideological spectrum. Integrating signalling theory with a cognitive perspective on reputation formation, we argue that the reputational impact of CEO activism depends on the firm's corporate social responsibility (CSR), which fosters perceptions of organizational authenticity. Using a national survey and an experiment, we find that CEO activism improves corporate reputation through perceived moral authenticity. This effect is stronger when firms hold B Corp certification, engage in philanthropic donations, or are perceived as more socially responsible. Although stakeholders rate firms as more reputable when their political ideology aligns with the CEO's activism, this relationship weakens when firms engage in CSR, thereby signalling authenticity. These findings demonstrate how non-­market strategies interact to shape corporate reputation and inform corporate sociopolitical advocacy among heterogeneous audiences.","Li, L. Z., & Soule, S. A. (2026). CEO activism and corporate reputation: How authenticity and CSR mitigate stakeholder misalignment. *Journal of Management Studies*. https://doi.org/10.1111/joms.70060",NBS/2026-02,library/NBS/2026-02/pdfs/Li 2026 CEO Activism and Corporate Reputation How Authenticity and CSR Mitigate Stakeholder Misalignment.pdf,library/NBS/2026-02/text/Li 2026 CEO Activism and Corporate Reputation How Authenticity and CSR Mitigate Stakeholder Misalignment.txt,notes/nbs-2026-02-li-2026-activism-corporate-reputation.md,claude-opus-4-6,v2,2026-04-17
nbs-2026-02-li-2026-female-equity-analysts,Female Equity Analysts and Corporate Environmental and Social Performance,2026,Management Science,https://doi.org/10.1287/mnsc.2024.06429,empirical-quantitative,firm,cross-level,mixed,"Archival empirical analysis combining hand-collected analyst gender data with E&S ratings; panel regressions with firm and year fixed effects; difference-in-differences around broker closures as a quasi-exogenous shock to female (male) analyst coverage; active-learning fine-tuning of FinBERT for E&S-topic classification on 2.4M analyst reports and 120K earnings call transcripts; Structural Topic Modeling (STM) and Linguistic Inquiry and Word Count (LIWC) for thematic, cognitive, and linguistic analysis; event-study tests of market reactions to analysts' E&S-related tone",Multi-industry publicly listed firms with analyst coverage (Fama-French 12 industries),United States,2005-2021 (main E&S sample); 2004-2020 (report-level and recommendation samples),Firm-year observations; analyst reports; earnings conference calls,"20,423 firm-year observations covering 3,567 unique firms; more than 11,000 sell-side equity analysts; 2.4 million analyst reports; 120,000 earnings call transcripts","Li, K.; Mai, F.; Wong, G.; Yang, C.; Zhang, T.",analyst monitoring / governance role of analysts; gender differences in values and preferences (psychology/economics); information intermediary theory,corporate-governance; csr-strategy; esg-disclosure; gender-in-organizations,FinBERT; RepRisk; analyst coverage; analyst monitoring; analyst reports; cognition; corporate environmental and social performance; earnings conference calls; female equity analysts; readability,"Does female equity analyst coverage causally influence firms' environmental and social (E&S) performance, and through what mechanisms—differences in research activities, thematic focus, cognitive and linguistic approaches, and post-report actions—do female analysts exert this influence compared with their male counterparts?","Drawing on psychological and economic evidence that women place greater weight than men on the well-being of others, communities, and the environment, the authors argue that female equity analysts—who already constitute a selected, highly skilled group in a male-dominated profession—are more attentive to corporate E&S issues than male analysts. Through their research activities (writing reports, questioning managers on earnings calls), female analysts identify value-relevant E&S risks and communicate them with greater thematic breadth (regulatory compliance, stakeholder welfare, environment), more sophisticated cognitive processing, and greater clarity. These signals exert governance pressure on management because female analysts are also more willing to downgrade recommendations and target prices after negative E&S content, and investors react more strongly to their negative E&S tones. Together these information-production and monitoring channels lead firms with more female analyst coverage to improve their E&S performance.","The paper contributes to the gender-and-finance literature by showing that female equity analyst coverage causally improves corporate E&S performance, identifying gender diversity among sell-side analysts as an impetus for firms to adopt more environmentally and socially responsible policies. It extends the analyst-monitoring literature by taking a gender lens and uncovering the specific textual, cognitive, and action-based mechanisms through which female analysts influence firm outcomes, thereby explaining observed gender differences in analyst impact first documented by Kumar (2010). Methodologically, it advances the finance/accounting literature on computational linguistics by introducing a data-centric active-learning approach to fine-tune FinBERT on analyst reports and earnings-call transcripts for E&S-topic classification.","The findings imply that firms, brokerages, and regulators interested in strengthening corporate E&S performance should promote gender diversity in the equity analyst profession, since female analysts act as effective external monitors of E&S issues. Investors and asset managers can use female analysts' reports and negative tones as informative signals of firms' E&S risks and are already shown to respond more strongly to them. For corporate management, the evidence suggests that expanding coverage by female analysts increases the likelihood that E&S concerns will be raised publicly and priced into stock recommendations.","The analysis relies on hand-collected gender inferences and on E&S ratings (e.g., LSEG, ASSET4, KLD, Sustainalytics) that are known to contain measurement noise and inter-rater disagreement. The broker-closure design yields a small, clean treated-control sample, so the economic magnitude of the causal effect should be interpreted with care. The machine-learning pipeline, while extensively validated, still depends on the quality of human-labeled training data and on the coverage of the FinBERT backbone.",Not reported in paper,"stakeholders, and the environment, in both research reports and earnings conference calls. They also display distinct cognitive and linguistic patterns when discussing E&S issues. Fur­ thermore, female analysts are more likely to issue lower stock recommendations and target prices (lower stock recommendations) following negative E&S discussions in their reports (E&S incidents) than male analysts. Finally, investors respond more strongly to female analysts’ negative tones when discussing E&S issues. Overall, our findings suggest that gender diversity among analysts plays a significant role in shaping corporate E&S practices and provide new insights into the origins of gender differences in skills within the equity analyst profession.","Li, K., Mai, F., Wong, G., Yang, C., & Zhang, T. (2026). Female equity analysts and corporate environmental and social performance. *Management Science*. https://doi.org/10.1287/mnsc.2024.06429",NBS/2026-02,library/NBS/2026-02/pdfs/Li 2026 Female Equity Analysts and Corporate Environmental and Social Performance.pdf,library/NBS/2026-02/text/Li 2026 Female Equity Analysts and Corporate Environmental and Social Performance.txt,notes/nbs-2026-02-li-2026-female-equity-analysts.md,claude-opus-4-6,v2,2026-04-17
nbs-2026-02-lodge-2026,Organizations as Stages: A Dramaturgical Theory of the Societal Integration of Stigmatized Groups,2026,Journal of Management,https://doi.org/10.1177/01492063261421506,conceptual,organization,meso,social,"Conceptual theory development drawing on Goffman's relational perspective on stigma and dramaturgical metaphors; derives a typology of staging forms (concealing and normalizing), identifies structural antecedents, and develops eight propositions",Not reported in paper,Not reported in paper,Not reported in paper,Not reported in paper,Not reported in paper,"Lodge, J.; Helms, W. S.; Roulet, T.; Tracey, P.",Goffman's relational perspective on stigma; dramaturgical theory; stigma management,diversity-equity-inclusion; stakeholder-engagement; workplace-discrimination,audiences; dramaturgy; organizations; societal integration; stigma,"How can organizations, conceptualized as ""stages,"" enable the societal integration of stigmatized groups by presenting them to diverse stigmatizing and supportive audiences, and what structural antecedents shape the forms of staging (concealing vs. normalizing) they adopt?","Drawing on Goffman's relational view, the authors argue that stigma is constituted through audience evaluations rather than being inherent to attributes, so integration depends on how organizations manage audiences. Organizations function as stages that present stigmatized groups in ways that either conceal stigmatized attributes from hostile audiences (reducing sanctions) or normalize them before sympathetic audiences (eliciting acceptance). The likelihood of concealing is driven primarily by the salience of stigmatized attributes, while normalizing is driven by their institutionalization. Because environments are fragmented and contain both stigmatizing and supportive audiences, organizations frequently must engage in both forms of staging simultaneously, generating tensions when visibility from normalizing undermines concealment efforts.","The paper makes three contributions. First, it reconceptualizes the integration of stigmatized groups as an inherently audience-focused process, departing from prior work that treats integration as a consequence of managing group attributes. Second, it develops a structural model in which forms of staging are driven by contextual antecedents (attribute salience and institutionalization) rather than by managerial preferences alone. Third, it theorizes concealing and normalizing as discrete, potentially simultaneous approaches rather than opposite ends of a continuum, and elaborates the dynamics and tensions that arise when organizations engage in both at once.","Managers should recognize that societal integration is not automatically achieved by openly celebrating stigmatized groups; in some contexts, deliberate concealment may be the most effective route to integration, an insight often overlooked in DEI debates that emphasize visibility. Integration outcomes depend on how different audiences evaluate stigmatized groups, so attribute-focused initiatives may fail if audience dynamics are ignored. Stigmatized groups can use the framework to anticipate trade-offs when selecting employers or advocacy partners, and organizations should involve stigmatized groups in co-creating staging approaches tailored to their needs.",Not reported in paper,"Future research could investigate the ""dark side"" of staging—how organizational actions may unintentionally exacerbate sanctions and deepen stigmatization when forms of staging and audiences are misaligned. Scholars could examine the relative weight of the structural antecedents, consider how organizations' own stigma interacts with that of the groups they support, and explore how technology and social-media-driven context collapse amplify or complicate concealing and normalizing activities.","This paper theorizes how organizations enable the societal integration of stigmatized groups. Drawing on Goffman’s relational perspective on stigma and his dramaturgical metaphors, we conceptualize organizations as “stages” on which stigmatized groups are presented to diverse audiences. We identify two fundamental forms of staging—concealing and normalizing— through which organizations can reduce sanctions from stigmatizing audiences and elicit acceptance among more supportive ones, thereby ultimately enabling societal integration. Our model specifies the structural antecedents that shape the likelihood of each form of staging, offering a nuanced understanding of when organizations adopt them as well as the tensions that may arise from doing so. Based on this, we extend research on organizations’ management of stigma by advancing a dramaturgical theory of the societal integration of stigmatized groups. Whereas prior work has largely assumed that managing the stigmatized attributes of groups is central (and often sufficient) for their broader integration, we demonstrate that integration ultimately depends on the management of audiences and must therefore be understood as an inherently audience-focused process.","Lodge, J., Helms, W. S., Roulet, T., & Tracey, P. (2026). Organizations as stages: A dramaturgical theory of the societal integration of stigmatized groups. *Journal of Management*. https://doi.org/10.1177/01492063261421506",NBS/2026-02,library/NBS/2026-02/pdfs/Lodge 2026 Organizations as Stages A Dramaturgical Theory of the Societal Integration of Stigmatized Groups.pdf,library/NBS/2026-02/text/Lodge 2026 Organizations as Stages A Dramaturgical Theory of the Societal Integration of Stigmatized Groups.txt,notes/nbs-2026-02-lodge-2026.md,claude-opus-4-6,v1,2026-04-14
